link,title,snippet,date,source
https://www.cnbc.com/2024/04/02/stock-market-today-live-updates.html,"Dow closes lower for a third day as stocks' second-quarter woes continue: 
Live updates","The Dow Jones Industrial Average ended Wednesday modestly lower as stocks 
struggled to shake off their second-quarter malaise. The 30-stock Dow fell 
43.10...",3 weeks ago,CNBC
https://www.reuters.com/markets/global-markets-wrapup-1-2024-04-17/,"US stocks end down, crude slides amid Fed, geopolitical crosscurrents","U.S. stocks closed lower on Wednesday as crude prices tumbled and investors 
weighed cautious U.S. Federal Reserve commentary and ongoing...",1 week ago,Reuters
https://www.thestar.com/business/s-p-tsx-composite-ekes-out-gain-u-s-stock-markets-fall/article_421423df-1e31-562e-ba01-9dd13a5f5c5d.html,"S&P/TSX composite ekes out gain, U.S. stock markets fall","TORONTO - Canada's main stock index eked out a gain Thursday thanks to 
energy and base metals, while U.S. stock markets fell,...",13 hours ago,Toronto Star
https://markets.businessinsider.com/news/stocks/stock-market-today-equity-rally-outlook-tesla-mega-cap-earnings-2024-4,"Stock Market Today: Markets Climb Ahead of Tesla, Mega-Cap Earnings","Stocks extended their rebound on Tuesday as investors shifted attention 
away from interest rate cuts to mega-cap earnings.",2 days ago,markets.businessinsider.com
https://au.finance.yahoo.com/news/tech-reverses-us-stock-losses-225338150.html,"Tech Reverses US Stock Losses, BOJ in Focus: Markets Wrap","(Bloomberg) -- Stellar earnings reports from Microsoft Corp. and Alphabet 
Inc triggered an after-hours tech rally that sent US futures...",10 hours ago,Yahoo Finance AU
https://apnews.com/article/stock-markets-inflation-cdeea722367b960f1a87b0b3d287fedd,"Stock market today: Wall Street gains ground following surprisingly strong 
US jobs report","Stocks posted solid gains on Wall Street as a strong report on employment 
showed the U.S. economy continues to chug along.",3 weeks ago,AP News
https://www.livemint.com/market/stock-market-news/wall-street-today-us-stocks-advance-after-tesla-earnings-11713966617019.html,"Wall Street today: US stocks drift, Tesla leads Nasdaq higher | Mint","Wall Street today: US stocks were drifting on Wednesday, with Tesla leading 
the Nasdaq higher, while the Dow Jones pared its early gains.",1 day ago,mint
https://www.cnbc.com/2024/04/01/stock-market-today-live-updates.html,"Dow tumbles nearly 400 points, falling for a second day in rough start to 
new quarter: Live updates","The Dow Jones Industrial Average fell for a second day, continuing Wall 
Street's lackluster start to the quarter.",3 weeks ago,CNBC
https://www.cnn.com/2024/04/25/economy/stagflation-us-economy-gdp/index.html,"Fears about stagflation are mounting in the US. It’s every central banker’s 
worst nightmare","For the past few years, the US economy has been growing at a pace that 
seemed too good to be true.",12 hours ago,CNN
https://www.livemint.com/market/stock-market-news/wall-street-today-us-stocks-gain-led-by-chip-shares-11713878238694.html,Wall Street today: US stocks gain on robust earnings | Mint,"At 9:49 a.m. ET, the Dow Jones was up 0.40 per cent, the S&P 500 added 0.69 
per cent, the Nasdaq rose 0.88 per cent.",2 days ago,mint
https://www.ft.com/content/156315c6-e5ec-45cf-94cf-c6ab5a2b7f7f,Should investors keep riding the US markets runaway train?,"“The way things have shifted is weird.” The neck-snapping turn in market 
expectations around interest rate cuts from the Federal Reserve — from...",1 month ago,Financial Times
https://www.ft.com/content/31c3a55b-9af9-4158-8a49-4397540571bf,New York Stock Exchange tests views on round-the-clock trading,"Poll comes as US regulators review Steve Cohen-backed proposal for a 24/7 
exchange.",4 days ago,Financial Times
https://www.investing.com/news/stock-market-news/us-stock-futures-sink-as-meta-guidance-miss-rattles-tech-3396167,"Stock Market Today: S&P 500 cuts some losses but ends lower on Meta-led 
tech slump By Investing.com","Investing.com-- The S&P 500 closed lower, but well off session lows 
Thursday as Meta cut come losses, though rising Treasury yields on...",1 day ago,Investing.com
https://www.bloomberg.com/news/articles/2024-04-01/stock-market-today-dow-s-p-live-updates,"Stock Market Today: Dow, S&P Live Updates for April 2","Stocks dropped after solid economic readings and a rally in commodities 
spurred speculation that major central banks will keep interest...",3 weeks ago,Bloomberg
https://apnews.com/article/stock-markets-vanke-inflation-e052261fcaab9121f05ef31b00778cd9,"Stock market today: Asian shares drop after Wall Street sinks on rate 
worries","Asian shares are mostly declining after Wall Street sank, hitting the 
brakes on what's been a nearly unstoppable romp.",3 weeks ago,AP News
https://www.bloomberg.com/news/articles/2024-04-11/stock-market-today-dow-s-p-live-updates,"Stock Market Today: Dow, S&P Live Updates for April 12","The financial world was roiled by a flare-up in geopolitical risks that 
sent stocks sliding — while spurring a flight to the safest corners...",2 weeks ago,Bloomberg
https://money.usnews.com/investing/articles/will-the-stock-market-crash-risk-factors,Will the Stock Market Crash in 2024? 6 Risk Factors,"Key Takeaways: · U.S. equities have been on a roll over the past six 
months. · Consumers are still fretting over high prices, and many are...",3 weeks ago,US News Money
https://www.bloomberg.com/news/articles/2024-04-16/stock-market-today-dow-s-p-live-updates,"Stock Market Today: Dow, S&P Live Updates for April 17","The stock market saw its longest losing streak since January as a handful 
of big techs sold off — despite a slide in bond yields.",1 week ago,Bloomberg.com
https://www.morningstar.com/markets/is-stock-market-expensive-right-now,Is the Stock Market Expensive Right Now?,"The stock market started 2024 with a blistering rally, with the Morningstar 
US Market Index up 7.8% so far and roughly 26% higher than its...",1 month ago,Morningstar
https://www.reuters.com/markets/us/futures-drift-higher-recent-data-bolsters-rate-cut-hopes-2024-04-04/,"Wall St sells off ahead of jobs report, investors digest Fed comments","The three major U.S. stock indexes fell more than 1% each and the S&P 500 
had its biggest daily percentage drop since Feb. 13 on Thursday as...",3 weeks ago,Reuters
https://www.livemint.com/market/stock-market-news/wall-street-today-us-stocks-rise-as-middle-east-tensions-ease-11713793593243.html,Wall Street today: US stocks rise as Middle East tensions ease | Mint,"At 9:40 a.m. ET, the Dow Jones was up 0.12 per cent, the S&P 500 added 0.36 
per cent, the Nasdaq rose 0.72 per cent.",3 days ago,mint
https://www.barrons.com/livecoverage/stock-market-today-041824/card/stock-futures-rise-amid-signs-of-u-s-economic-strength-aqxrTY53pJu7ni9VFwo9,Stock Futures Are Rising Amid Signs of Strength for the U.S. Economy,"U.S. stock futures pointed up early Thursday after the Federal Reserve's 
Beige Book, a summary of economic conditions in U.S. regions,...",1 week ago,Barron's
https://markets.businessinsider.com/news/stocks/stock-market-news-today-tesla-meta-1q24-earnings-fed-pce-2024-4,Stock Market Today: Indexes Recover As Traders Brace for Earnings,"US stocks closed higher on Monday, ending a six-day losing streak for the 
S&P 500. Traders are gearing up for earnings from high-profile...",3 days ago,markets.businessinsider.com
https://apnews.com/article/stock-markets-interest-inflation-508047a1cc3fbf57df9a830987057150,"Stock market today: Asian markets are mixed after a slow day on Wall St 
ahead of US inflation update","U.S. benchmark crude oil gained 4 cents early Wednesday to $85.27 per 
barrel in electronic trading on the New York Mercantile Exchange. On...",2 weeks ago,AP News
https://finance.yahoo.com/video/stocks-open-lower-us-gdp-135439158.html,"Stocks open lower on US GDP print, tech earnings","The major stock market averages (^DJI, ^IXIC, ^GSPC) are opening Thursday 
lower on the first-quarter GDP print and Big Tech stocks earnings...",20 hours ago,Yahoo Finance
